<?xml version="1.0" encoding="UTF-8"?>
<!--<!DOCTYPE configuration PUBLIC "-//nybatis.org//DTD Mapper 3.0//EN" "nybatis-config.dtd">-->
<!--<!DOCTYPE configuration SYSTEM "nybatis-config.dtd">-->

<configuration xmlns:xsi="http://www.w3.org/2001/XMLSchema-instance"
       xsi:noNamespaceSchemaLocation="file:/C:\NIDE\workspace\NayasisCore\NyBatisCore\schema\nybatis-config.xsd">

  <properties path="config.properties">
    <property key="username" value="nayasis+#{driver}"/>
    <property key="password" value="F332459"/>
  </properties>

  <environment id="sample01" default="true">
    <datasource type="jdbc" poolMin="5" poolMax="20" poolStep="5" ping="true" pingCycle="60" >
      <driver>#{driver}</driver>
      <url>#{url}</url>
      <username>#{username}</username>
      <password>#{password}</password>
      <timeout>25</timeout> <!-- Optional -->
      <autocommit>false</autocommit> <!-- Optional -->
    </datasource>
    <sqlpath>
      <path>test01/sample.xml</path>
      <path>test02/sub01</path>
    </sqlpath>
  </environment>

  <environment id="sample02">
    <datasource type="jdbc">
      <driver>org.sqlite.JDBC</driver>
      <url>jdbc:sqlite:./target/test-classes/localDb/SimpleLauncherHelloWorld.db</url>
    </datasource>
    <sqlpath>
      <!--<path>test02/sub02</path>-->
      <!--<path>test02/sub02</path>-->
    </sqlpath>
  </environment>

  <environment id="sample03">
    <datasource type="jndi">
      <initialContext>....</initialContext>
      <providerUrl>....</providerUrl>
      <!-- it is possible to omit "java:comp/env/" -->
      <name>java:comp/env/Sample</name>
    </datasource>
    <sqlpath>
      <path>test03</path>
    </sqlpath>
  </environment>


</configuration>